{
  "schemaVersion": 2,
  "caseId": "E08_puzzle",
  "treatment": "baseline",
  "controls": {
    "blocklyVersion": "13.1.1",
    "browserViewport": {
      "height": 800,
      "width": 1280
    },
    "locale": "en",
    "renderer": "geras",
    "theme": "classic",
    "workspaceViewport": {
      "height": 640,
      "width": 1024
    }
  },
  "blocks": [
    {
      "type": "animal",
      "elements": [
        {
          "kind": "input",
          "name": "",
          "inputKind": "dummy"
        },
        {
          "kind": "field",
          "name": "NAME",
          "fieldKind": "field_label",
          "inputName": ""
        },
        {
          "kind": "input",
          "name": "PIC",
          "inputKind": "value"
        },
        {
          "kind": "field",
          "name": null,
          "fieldKind": "field_label",
          "inputName": "PIC"
        },
        {
          "kind": "input",
          "name": "",
          "inputKind": "dummy"
        },
        {
          "kind": "field",
          "name": null,
          "fieldKind": "field_label",
          "inputName": ""
        },
        {
          "kind": "field",
          "name": "LEGS",
          "fieldKind": "field_dropdown",
          "inputName": ""
        },
        {
          "kind": "input",
          "name": "TRAITS",
          "inputKind": "statement"
        },
        {
          "kind": "field",
          "name": null,
          "fieldKind": "field_label",
          "inputName": "TRAITS"
        }
      ],
      "inputs": [
        {
          "name": "",
          "kind": "dummy",
          "check": null,
          "alignment": -1,
          "fields": [
            {
              "name": "NAME",
              "kind": "field_label",
              "value": "Duck",
              "text": "Duck",
              "options": null,
              "constraints": null
            }
          ]
        },
        {
          "name": "PIC",
          "kind": "value",
          "check": null,
          "alignment": 1,
          "fields": [
            {
              "name": null,
              "kind": "field_label",
              "value": "picture:",
              "text": "picture:",
              "options": null,
              "constraints": null
            }
          ]
        },
        {
          "name": "",
          "kind": "dummy",
          "check": null,
          "alignment": 1,
          "fields": [
            {
              "name": null,
              "kind": "field_label",
              "value": "legs:",
              "text": "legs:",
              "options": null,
              "constraints": null
            },
            {
              "name": "LEGS",
              "kind": "field_dropdown",
              "value": "0",
              "text": "choose...",
              "options": [
                {
                  "label": "choose...",
                  "value": "0"
                },
                {
                  "label": "  0  ",
                  "value": "4"
                },
                {
                  "label": "  2  ",
                  "value": "1"
                },
                {
                  "label": "  4  ",
                  "value": "2"
                },
                {
                  "label": "  6  ",
                  "value": "3"
                }
              ],
              "constraints": null
            }
          ]
        },
        {
          "name": "TRAITS",
          "kind": "statement",
          "check": null,
          "alignment": -1,
          "fields": [
            {
              "name": null,
              "kind": "field_label",
              "value": "traits:",
              "text": "traits:",
              "options": null,
              "constraints": null
            }
          ]
        }
      ],
      "connections": {
        "previous": null,
        "next": null,
        "output": null
      },
      "inputsInline": false,
      "colour": "#5ba55b",
      "tooltip": "",
      "helpUrl": "https://en.wikipedia.org/wiki/Duck",
      "dynamicBehaviour": [
        "data-driven-leg-menu",
        "data-driven-populate",
        "dom-to-mutation",
        "help-url-from-mutation",
        "mutation-to-dom"
      ]
    },
    {
      "type": "picture",
      "elements": [
        {
          "kind": "input",
          "name": "PIC",
          "inputKind": "dummy"
        },
        {
          "kind": "field",
          "name": null,
          "fieldKind": "field_image",
          "inputName": "PIC"
        }
      ],
      "inputs": [
        {
          "name": "PIC",
          "kind": "dummy",
          "check": null,
          "alignment": -1,
          "fields": [
            {
              "name": null,
              "kind": "field_image",
              "value": "puzzle/duck.jpg",
              "text": "",
              "options": null,
              "constraints": null
            }
          ]
        }
      ],
      "connections": {
        "previous": null,
        "next": null,
        "output": {
          "check": null
        }
      },
      "inputsInline": false,
      "colour": "#a5805b",
      "tooltip": "",
      "helpUrl": null,
      "dynamicBehaviour": [
        "data-driven-image",
        "data-driven-populate",
        "dom-to-mutation",
        "mutation-to-dom"
      ]
    },
    {
      "type": "trait",
      "elements": [
        {
          "kind": "input",
          "name": "",
          "inputKind": "dummy"
        },
        {
          "kind": "field",
          "name": "NAME",
          "fieldKind": "field_label",
          "inputName": ""
        }
      ],
      "inputs": [
        {
          "name": "",
          "kind": "dummy",
          "check": null,
          "alignment": -1,
          "fields": [
            {
              "name": "NAME",
              "kind": "field_label",
              "value": "Feathers",
              "text": "Feathers",
              "options": null,
              "constraints": null
            }
          ]
        }
      ],
      "connections": {
        "previous": {
          "check": null
        },
        "next": {
          "check": null
        },
        "output": null
      },
      "inputsInline": false,
      "colour": "#995ba5",
      "tooltip": "",
      "helpUrl": null,
      "dynamicBehaviour": [
        "data-driven-label",
        "data-driven-populate",
        "dom-to-mutation",
        "mutation-to-dom"
      ]
    }
  ],
  "toolbox": null,
  "initialWorkspace": {
    "blocks": [
      {
        "animal": 1,
        "type": "animal"
      },
      {
        "animal": 1,
        "type": "picture"
      },
      {
        "animal": 1,
        "trait": 1,
        "type": "trait"
      },
      {
        "animal": 1,
        "trait": 2,
        "type": "trait"
      },
      {
        "animal": 2,
        "type": "animal"
      },
      {
        "animal": 2,
        "type": "picture"
      },
      {
        "animal": 2,
        "trait": 1,
        "type": "trait"
      },
      {
        "animal": 2,
        "trait": 2,
        "type": "trait"
      },
      {
        "animal": 3,
        "type": "animal"
      },
      {
        "animal": 3,
        "type": "picture"
      },
      {
        "animal": 3,
        "trait": 1,
        "type": "trait"
      },
      {
        "animal": 3,
        "trait": 2,
        "type": "trait"
      },
      {
        "animal": 4,
        "type": "animal"
      },
      {
        "animal": 4,
        "type": "picture"
      },
      {
        "animal": 4,
        "trait": 1,
        "type": "trait"
      },
      {
        "animal": 4,
        "trait": 2,
        "type": "trait"
      }
    ],
    "deletable": false,
    "layout": "randomized-top-level-inventory"
  },
  "generators": [
    {
      "type": "animal",
      "language": "javascript",
      "registered": false,
      "metadata": null
    },
    {
      "type": "picture",
      "language": "javascript",
      "registered": false,
      "metadata": null
    },
    {
      "type": "trait",
      "language": "javascript",
      "registered": false,
      "metadata": null
    }
  ],
  "errors": []
}
